{
  "$schema": "./fspm-conformance.schema.json",
  "schema": "screeps-fspm-conformance/v1",
  "profileVersion": 1,
  "profileStatus": "partial",
  "evaluatedAt": "2026-08-31",
  "implementationBaseline": "75d83f695dab92220119fa206a44230041e95c29",
  "governance": {
    "repository": "Namauu/governance-docs",
    "commit": "02d581886a759d19044ff91a80d743fa042f23f7",
    "reviewRule": "A governance commit change requires an explicit conformance review before the runtime catalog may adopt it."
  },
  "statusDefinitions": {
    "implemented": "Canonical field or invariant is represented and enforced without semantic adaptation.",
    "adapted": "Canonical semantics are preserved through a documented Screeps-domain mapping.",
    "not_implemented": "Required canonical semantics are absent or insufficiently enforced.",
    "not_applicable": "The canonical concern does not apply to the governed Screeps domain and has an explicit rationale."
  },
  "components": [
    {
      "key": "p3",
      "name": "P3 Portfolio record",
      "status": "not_implemented",
      "owner": "area:fspm",
      "issue": "#183",
      "canonicalSources": [
        "execution/data/p3.md#4-record-schema",
        "structure/fspm-framework.md#06-portfolio-management"
      ],
      "fields": [
        {
          "key": "name",
          "status": "adapted",
          "adaptation": "Stable empire and colony Portfolio names replace OU-coded corporate names until the OU model exists.",
          "evidence": ["packages/runtime/src/planning/fspm.ts"]
        },
        {
          "key": "description",
          "status": "implemented",
          "evidence": ["packages/runtime/src/planning/fspm.ts"]
        },
        {
          "key": "type",
          "status": "implemented",
          "evidence": ["packages/runtime/src/planning/fspm.ts"]
        },
        {
          "key": "sub_type",
          "status": "implemented",
          "evidence": ["packages/runtime/src/planning/fspm.ts"]
        },
        {
          "key": "start_date",
          "status": "adapted",
          "adaptation": "Game ticks are the authoritative runtime clock; startTick is the deterministic Start Date mapping.",
          "evidence": [
            "docs/adr-fspm-p3-authority.md",
            "packages/runtime/src/planning/fspm.ts"
          ]
        },
        {
          "key": "end_date",
          "status": "not_applicable",
          "rationale": "The current Empire and colony records are continuously managed Portfolios; canonical Portfolios have no end date until retirement."
        },
        {
          "key": "parent_p3_id",
          "status": "implemented",
          "evidence": [
            "packages/runtime/src/planning/fspm.ts",
            "packages/runtime/test/planning/fspm-p3-authority.test.ts"
          ]
        },
        {
          "key": "unanet_contract_code",
          "status": "not_applicable",
          "rationale": "Screeps has no Unanet ERP or labor-cost integration. Runtime lineage uses immutable P3 identifiers."
        },
        {
          "key": "unanet_contract_key",
          "status": "not_applicable",
          "rationale": "Screeps has no Unanet ERP or labor-cost integration. Runtime lineage uses immutable P3 identifiers."
        }
      ],
      "invariants": [
        {
          "key": "portfolio_classification",
          "status": "implemented",
          "evidence": [
            "docs/adr-fspm-p3-authority.md",
            "packages/runtime/test/planning/fspm-p3-authority.test.ts"
          ]
        },
        {
          "key": "continuous_prioritization_and_rebalancing",
          "status": "not_implemented",
          "rationale": "Portfolio records exist, but cross-colony value, risk, urgency, quality, capacity, and resource rebalancing is not yet governed or replayable.",
          "issue": "#127"
        },
        {
          "key": "ou_identity",
          "status": "not_implemented",
          "rationale": "No Organizational Unit record anchors the root Portfolio or derives its accountable Position.",
          "issue": "#164"
        }
      ]
    },
    {
      "key": "corporate_requirement",
      "name": "Corporate Requirement record",
      "status": "adapted",
      "owner": "area:fspm",
      "issue": "#164",
      "canonicalSources": [
        "execution/data/corporate-requirements.md#4-record-schema"
      ],
      "fields": [
        {
          "key": "id",
          "status": "implemented",
          "evidence": ["packages/runtime/src/planning/fspm.ts"]
        },
        {
          "key": "title",
          "status": "implemented",
          "evidence": ["packages/runtime/src/planning/fspm.ts"]
        },
        {
          "key": "requestor",
          "status": "adapted",
          "adaptation": "A source-controlled repository governance principal identifies the autonomous requestor; a canonical human Employee record remains #164.",
          "evidence": [
            "packages/runtime/src/planning/fspm-governance.ts",
            "docs/adr-fspm-governed-authority.md"
          ],
          "issue": "#164"
        },
        {
          "key": "requirement_trigger",
          "status": "implemented",
          "evidence": ["packages/runtime/src/planning/fspm-governance.ts"]
        },
        {
          "key": "requirement_source",
          "status": "implemented",
          "evidence": [
            "docs/screeps-colony-operations-policy.md",
            "packages/runtime/src/planning/fspm-governance.ts"
          ]
        },
        {
          "key": "requirement_verbiage",
          "status": "implemented",
          "evidence": [
            "docs/screeps-colony-operations-policy.md",
            "packages/runtime/src/planning/fspm-governance.ts"
          ]
        },
        {
          "key": "originating_authority",
          "status": "not_applicable",
          "rationale": "Authority package v1 contains derived Requirements with an immutable Requirement Source, so Originating Authority must be absent by the canonical exclusive-origin rule."
        },
        {
          "key": "purpose_statement",
          "status": "implemented",
          "evidence": ["packages/runtime/src/planning/fspm-governance.ts"]
        },
        {
          "key": "strategic_priority",
          "status": "implemented",
          "evidence": ["packages/runtime/src/planning/fspm-governance.ts"]
        },
        {
          "key": "strategic_alignment",
          "status": "implemented",
          "evidence": ["packages/runtime/src/planning/fspm-governance.ts"]
        },
        {
          "key": "applicable_ou",
          "status": "adapted",
          "adaptation": "Stable empire-operations and colony-scoped OU identities bind applicability; canonical Employee/Position-backed OU records remain #164.",
          "evidence": [
            "packages/runtime/src/planning/fspm.ts",
            "docs/adr-fspm-governed-authority.md"
          ],
          "issue": "#164"
        },
        {
          "key": "desired_outcomes",
          "status": "implemented",
          "evidence": ["packages/runtime/src/planning/fspm-governance.ts"]
        },
        {
          "key": "business_case",
          "status": "implemented",
          "evidence": ["packages/runtime/src/planning/fspm-governance.ts"]
        },
        {
          "key": "approval_authority",
          "status": "adapted",
          "adaptation": "The Department OU, accountable Position identity, and source-controlled service principal are bound; canonical human Accountable authority remains #164.",
          "evidence": [
            "packages/runtime/src/planning/fspm-governance.ts",
            "docs/adr-fspm-governed-authority.md"
          ],
          "issue": "#164"
        },
        {
          "key": "approval",
          "status": "adapted",
          "adaptation": "A content-pinned source-control policy attestation activates the full package before planning; it is explicitly not represented as human approval.",
          "evidence": [
            "packages/runtime/src/planning/fspm.ts",
            "packages/runtime/test/planning/fspm-governed-authority.test.ts"
          ],
          "issue": "#164"
        },
        {
          "key": "approved_by",
          "status": "adapted",
          "adaptation": "The accountable source-controlled service principal is recorded and validated; it does not substitute for a canonical human Employee.",
          "evidence": [
            "packages/runtime/src/planning/fspm.ts",
            "docs/adr-fspm-governed-authority.md"
          ],
          "issue": "#164"
        },
        {
          "key": "approval_signature",
          "status": "adapted",
          "adaptation": "An immutable typed source-control policy attestation and signed content hash replace a human typed-name signature.",
          "evidence": ["packages/runtime/src/planning/fspm-governance.ts"],
          "issue": "#164"
        },
        {
          "key": "date_approved",
          "status": "adapted",
          "adaptation": "The source-controlled service-principal policy-attestation date is retained; it is not a canonical human approval date.",
          "evidence": ["packages/runtime/src/planning/fspm-governance.ts"],
          "issue": "#164"
        },
        {
          "key": "created_date",
          "status": "adapted",
          "adaptation": "createdAt stores the authoritative game tick rather than a wall-clock timestamp.",
          "evidence": ["packages/runtime/src/planning/fspm.ts"]
        },
        {
          "key": "modified_date",
          "status": "adapted",
          "adaptation": "updatedAt stores the authoritative game tick rather than a wall-clock timestamp.",
          "evidence": ["packages/runtime/src/planning/fspm.ts"]
        },
        {
          "key": "created_by",
          "status": "adapted",